,TITLE,ALBUM,YEAR,TYPE,Text,Doc,Tokens,Lemmas,POS,Proper_Nouns,Named_Entities,NE_Words
23,All Your Sisters,Among My Swan,1996,ALBUM,"And I knew I was close to you And I will Catch me flying in the sun Catch me drinking of your wine I'm gonna put something in you Make the devil feel surprised All your sisters wanna fly Around my golden sky Around my golden sky Just because you feel, hollow inside it's real Just because you feel, hollow inside it's real I'm gonna put something in you Make the devil feel surprised Make the devil feel surprised And I knew I was close to you And I knew Catch me flying in the sun Catch me drinking of your wine","And I knew I was close to you And I will Catch me flying in the sun Catch me drinking of your wine I'm gonna put something in you Make the devil feel surprised All your sisters wanna fly Around my golden sky Around my golden sky Just because you feel, hollow inside it's real Just because you feel, hollow inside it's real I'm gonna put something in you Make the devil feel surprised Make the devil feel surprised And I knew I was close to you And I knew Catch me flying in the sun Catch me drinking of your wine","['And', 'I', 'knew', 'I', 'was', 'close', 'to', 'you', 'And', 'I', 'will', 'Catch', 'me', 'flying', 'in', 'the', 'sun', 'Catch', 'me', 'drinking', 'of', 'your', 'wine', 'I', ""'m"", 'gon', 'na', 'put', 'something', 'in', 'you', 'Make', 'the', 'devil', 'feel', 'surprised', 'All', 'your', 'sisters', 'wanna', 'fly', 'Around', 'my', 'golden', 'sky', 'Around', 'my', 'golden', 'sky', 'Just', 'because', 'you', 'feel', ',', 'hollow', 'inside', 'it', ""'s"", 'real', 'Just', 'because', 'you', 'feel', ',', 'hollow', 'inside', 'it', ""'s"", 'real', 'I', ""'m"", 'gon', 'na', 'put', 'something', 'in', 'you', 'Make', 'the', 'devil', 'feel', 'surprised', 'Make', 'the', 'devil', 'feel', 'surprised', 'And', 'I', 'knew', 'I', 'was', 'close', 'to', 'you', 'And', 'I', 'knew', 'Catch', 'me', 'flying', 'in', 'the', 'sun', 'Catch', 'me', 'drinking', 'of', 'your', 'wine']","['and', 'I', 'know', 'I', 'be', 'close', 'to', 'you', 'and', 'I', 'will', 'catch', 'I', 'fly', 'in', 'the', 'sun', 'catch', 'I', 'drinking', 'of', 'your', 'wine', 'I', 'be', 'go', 'to', 'put', 'something', 'in', 'you', 'make', 'the', 'devil', 'feel', 'surprise', 'all', 'your', 'sister', 'wanna', 'fly', 'around', 'my', 'golden', 'sky', 'around', 'my', 'golden', 'sky', 'just', 'because', 'you', 'feel', ',', 'hollow', 'inside', 'it', 'be', 'real', 'just', 'because', 'you', 'feel', ',', 'hollow', 'inside', 'it', 'be', 'real', 'I', 'be', 'go', 'to', 'put', 'something', 'in', 'you', 'make', 'the', 'devil', 'feel', 'surprised', 'make', 'the', 'devil', 'feel', 'surprised', 'and', 'I', 'know', 'I', 'be', 'close', 'to', 'you', 'and', 'I', 'know', 'catch', 'I', 'fly', 'in', 'the', 'sun', 'catch', 'I', 'drinking', 'of', 'your', 'wine']","[('CCONJ', 'CC'), ('PRON', 'PRP'), ('VERB', 'VBD'), ('PRON', 'PRP'), ('AUX', 'VBD'), ('ADJ', 'JJ'), ('ADP', 'IN'), ('PRON', 'PRP'), ('CCONJ', 'CC'), ('PRON', 'PRP'), ('AUX', 'MD'), ('VERB', 'VB'), ('PRON', 'PRP'), ('VERB', 'VBG'), ('ADP', 'IN'), ('DET', 'DT'), ('NOUN', 'NN'), ('VERB', 'VB'), ('PRON', 'PRP'), ('NOUN', 'NN'), ('ADP', 'IN'), ('PRON', 'PRP$'), ('NOUN', 'NN'), ('PRON', 'PRP'), ('AUX', 'VBP'), ('VERB', 'VBG'), ('PART', 'TO'), ('VERB', 'VB'), ('PRON', 'NN'), ('ADP', 'IN'), ('PRON', 'PRP'), ('VERB', 'VBP'), ('DET', 'DT'), ('NOUN', 'NN'), ('VERB', 'VB'), ('VERB', 'VBD'), ('DET', 'PDT'), ('PRON', 'PRP$'), ('NOUN', 'NNS'), ('AUX', 'MD'), ('VERB', 'VB'), ('ADP', 'IN'), ('PRON', 'PRP$'), ('ADJ', 'JJ'), ('NOUN', 'NN'), ('ADP', 'IN'), ('PRON', 'PRP$'), ('ADJ', 'JJ'), ('NOUN', 'NN'), ('ADV', 'RB'), ('SCONJ', 'IN'), ('PRON', 'PRP'), ('VERB', 'VBP'), ('PUNCT', ','), ('ADJ', 'JJ'), ('ADP', 'IN'), ('PRON', 'PRP'), ('AUX', 'VBZ'), ('ADJ', 'JJ'), ('ADV', 'RB'), ('SCONJ', 'IN'), ('PRON', 'PRP'), ('VERB', 'VBP'), ('PUNCT', ','), ('ADJ', 'JJ'), ('ADP', 'IN'), ('PRON', 'PRP'), ('AUX', 'VBZ'), ('ADJ', 'JJ'), ('PRON', 'PRP'), ('AUX', 'VBP'), ('VERB', 'VBG'), ('PART', 'TO'), ('VERB', 'VB'), ('PRON', 'NN'), ('ADP', 'IN'), ('PRON', 'PRP'), ('VERB', 'VBP'), ('DET', 'DT'), ('NOUN', 'NN'), ('VERB', 'VB'), ('ADJ', 'JJ'), ('VERB', 'VBP'), ('DET', 'DT'), ('NOUN', 'NN'), ('VERB', 'VB'), ('ADJ', 'JJ'), ('CCONJ', 'CC'), ('PRON', 'PRP'), ('VERB', 'VBD'), ('PRON', 'PRP'), ('AUX', 'VBD'), ('ADJ', 'JJ'), ('ADP', 'IN'), ('PRON', 'PRP'), ('CCONJ', 'CC'), ('PRON', 'PRP'), ('VERB', 'VBD'), ('VERB', 'VB'), ('PRON', 'PRP'), ('VERB', 'VBG'), ('ADP', 'IN'), ('DET', 'DT'), ('NOUN', 'NN'), ('VERB', 'VB'), ('PRON', 'PRP'), ('NOUN', 'NN'), ('ADP', 'IN'), ('PRON', 'PRP$'), ('NOUN', 'NN')]",[],['PERSON'],[Catch]
24,"Cry, Cry",Among My Swan,1996,ALBUM,"Cry, cry for you Just like you knew I wouldn't do Cry, cry for you Just like a song in the last light Should I leave it all away Not like the kindness that you gave That's why it never seems the same Behind your eyes I stood behind when no one asked me And took you home after the fight I drove my car into city lights Drove down the road that I am on Cry, cry for you That's what you think I want to be Cry, cry for you An empty heart that sees me through Cry, cry for you Just like you knew I wouldn't do Cry cry for you Just like a song in the last light Cry, cry for you","Cry, cry for you Just like you knew I wouldn't do Cry, cry for you Just like a song in the last light Should I leave it all away Not like the kindness that you gave That's why it never seems the same Behind your eyes I stood behind when no one asked me And took you home after the fight I drove my car into city lights Drove down the road that I am on Cry, cry for you That's what you think I want to be Cry, cry for you An empty heart that sees me through Cry, cry for you Just like you knew I wouldn't do Cry cry for you Just like a song in the last light Cry, cry for you","['Cry', ',', 'cry', 'for', 'you', 'Just', 'like', 'you', 'knew', 'I', 'would', ""n't"", 'do', 'Cry', ',', 'cry', 'for', 'you', 'Just', 'like', 'a', 'song', 'in', 'the', 'last', 'light', 'Should', 'I', 'leave', 'it', 'all', 'away', 'Not', 'like', 'the', 'kindness', 'that', 'you', 'gave', 'That', ""'s"", 'why', 'it', 'never', 'seems', 'the', 'same', 'Behind', 'your', 'eyes', 'I', 'stood', 'behind', 'when', 'no', 'one', 'asked', 'me', 'And', 'took', 'you', 'home', 'after', 'the', 'fight', 'I', 'drove', 'my', 'car', 'into', 'city', 'lights', 'Drove', 'down', 'the', 'road', 'that', 'I', 'am', 'on', 'Cry', ',', 'cry', 'for', 'you', 'That', ""'s"", 'what', 'you', 'think', 'I', 'want', 'to', 'be', 'Cry', ',', 'cry', 'for', 'you', 'An', 'empty', 'heart', 'that', 'sees', 'me', 'through', 'Cry', ',', 'cry', 'for', 'you', 'Just', 'like', 'you', 'knew', 'I', 'would', ""n't"", 'do', 'Cry', 'cry', 'for', 'you', 'Just', 'like', 'a', 'song', 'in', 'the', 'last', 'light', 'Cry', ',', 'cry', 'for', 'you']","['Cry', ',', 'cry', 'for', 'you', 'just', 'like', 'you', 'know', 'I', 'would', 'not', 'do', 'cry', ',', 'cry', 'for', 'you', 'just', 'like', 'a', 'song', 'in', 'the', 'last', 'light', 'should', 'I', 'leave', 'it', 'all', 'away', 'not', 'like', 'the', 'kindness', 'that', 'you', 'give', 'that', 'be', 'why', 'it', 'never', 'seem', 'the', 'same', 'behind', 'your', 'eye', 'I', 'stand', 'behind', 'when', 'no', 'one', 'ask', 'I', 'and', 'take', 'you', 'home', 'after', 'the', 'fight', 'I', 'drive', 'my', 'car', 'into', 'city', 'light', 'drive', 'down', 'the', 'road', 'that', 'I', 'be', 'on', 'Cry', ',', 'cry', 'for', 'you', 'that', 'be', 'what', 'you', 'think', 'I', 'want', 'to', 'be', 'Cry', ',', 'cry', 'for', 'you', 'an', 'empty', 'heart', 'that', 'see', 'I', 'through', 'Cry', ',', 'cry', 'for', 'you', 'just', 'like', 'you', 'know', 'I', 'would', 'not', 'do', 'cry', 'cry', 'for', 'you', 'just', 'like', 'a', 'song', 'in', 'the', 'last', 'light', 'Cry', ',', 'cry', 'for', 'you']","[('PROPN', 'NNP'), ('PUNCT', ','), ('VERB', 'VB'), ('ADP', 'IN'), ('PRON', 'PRP'), ('ADV', 'RB'), ('SCONJ', 'IN'), ('PRON', 'PRP'), ('VERB', 'VBD'), ('PRON', 'PRP'), ('AUX', 'MD'), ('PART', 'RB'), ('VERB', 'VB'), ('VERB', 'VB'), ('PUNCT', ','), ('VERB', 'VB'), ('ADP', 'IN'), ('PRON', 'PRP'), ('ADV', 'RB'), ('ADP', 'IN'), ('DET', 'DT'), ('NOUN', 'NN'), ('ADP', 'IN'), ('DET', 'DT'), ('ADJ', 'JJ'), ('NOUN', 'NN'), ('AUX', 'MD'), ('PRON', 'PRP'), ('VERB', 'VB'), ('PRON', 'PRP'), ('PRON', 'DT'), ('ADV', 'RB'), ('PART', 'RB'), ('ADP', 'IN'), ('DET', 'DT'), ('NOUN', 'NN'), ('PRON', 'WDT'), ('PRON', 'PRP'), ('VERB', 'VBD'), ('PRON', 'DT'), ('AUX', 'VBZ'), ('SCONJ', 'WRB'), ('PRON', 'PRP'), ('ADV', 'RB'), ('VERB', 'VBZ'), ('DET', 'DT'), ('ADJ', 'JJ'), ('ADP', 'IN'), ('PRON', 'PRP$'), ('NOUN', 'NNS'), ('PRON', 'PRP'), ('VERB', 'VBD'), ('ADV', 'RB'), ('SCONJ', 'WRB'), ('DET', 'DT'), ('NOUN', 'NN'), ('VERB', 'VBD'), ('PRON', 'PRP'), ('CCONJ', 'CC'), ('VERB', 'VBD'), ('PRON', 'PRP'), ('ADV', 'RB'), ('SCONJ', 'IN'), ('DET', 'DT'), ('NOUN', 'NN'), ('PRON', 'PRP'), ('VERB', 'VBD'), ('PRON', 'PRP$'), ('NOUN', 'NN'), ('ADP', 'IN'), ('NOUN', 'NN'), ('NOUN', 'NNS'), ('VERB', 'VBD'), ('ADP', 'IN'), ('DET', 'DT'), ('NOUN', 'NN'), ('PRON', 'WDT'), ('PRON', 'PRP'), ('AUX', 'VBP'), ('ADP', 'IN'), ('PROPN', 'NNP'), ('PUNCT', ','), ('VERB', 'VB'), ('ADP', 'IN'), ('PRON', 'PRP'), ('PRON', 'DT'), ('AUX', 'VBZ'), ('PRON', 'WP'), ('PRON', 'PRP'), ('VERB', 'VBP'), ('PRON', 'PRP'), ('VERB', 'VBP'), ('PART', 'TO'), ('AUX', 'VB'), ('PROPN', 'NNP'), ('PUNCT', ','), ('VERB', 'VB'), ('ADP', 'IN'), ('PRON', 'PRP'), ('DET', 'DT'), ('ADJ', 'JJ'), ('NOUN', 'NN'), ('PRON', 'WDT'), ('VERB', 'VBZ'), ('PRON', 'PRP'), ('ADP', 'IN'), ('PROPN', 'NNP'), ('PUNCT', ','), ('VERB', 'VB'), ('ADP', 'IN'), ('PRON', 'PRP'), ('ADV', 'RB'), ('SCONJ', 'IN'), ('PRON', 'PRP'), ('VERB', 'VBD'), ('PRON', 'PRP'), ('AUX', 'MD'), ('PART', 'RB'), ('VERB', 'VB'), ('VERB', 'VB'), ('VERB', 'VB'), ('ADP', 'IN'), ('PRON', 'PRP'), ('ADV', 'RB'), ('ADP', 'IN'), ('DET', 'DT'), ('NOUN', 'NN'), ('ADP', 'IN'), ('DET', 'DT'), ('ADJ', 'JJ'), ('NOUN', 'NN'), ('PROPN', 'NNP'), ('PUNCT', ','), ('VERB', 'VB'), ('ADP', 'IN'), ('PRON', 'PRP')]","['Cry', 'Cry', 'Cry', 'Cry', 'Cry']","['ORG', 'ORG']","[Cry, Cry]"
25,Disappear,Among My Swan,1996,ALBUM,Just because You call my name I cannot hear It's not the same (Can't close my/you close your) eyes And knock me back All the things that I had to (have/live) (And now you)...just...(fallen...) I can't believe what I had to say All the things you never say I'll never be what you want me to be Now I can't disappear Close your eyes and look at me I can't believe what I cannot see Everything is like you say Change your mind and you'll have to forgive And I can't disappear Now I can't Now I can't,Just because You call my name I cannot hear It's not the same (Can't close my/you close your) eyes And knock me back All the things that I had to (have/live) (And now you)...just...(fallen...) I can't believe what I had to say All the things you never say I'll never be what you want me to be Now I can't disappear Close your eyes and look at me I can't believe what I cannot see Everything is like you say Change your mind and you'll have to forgive And I can't disappear Now I can't Now I can't,"['Just', 'because', 'You', 'call', 'my', 'name', 'I', 'can', 'not', 'hear', 'It', ""'s"", 'not', 'the', 'same', '(', 'Ca', ""n't"", 'close', 'my', '/', 'you', 'close', 'your', ')', 'eyes', 'And', 'knock', 'me', 'back', 'All', 'the', 'things', 'that', 'I', 'had', 'to', '(', 'have', '/', 'live', ')', '(', 'And', 'now', 'you)', '...', 'just', '...', '(fallen', '...', ')', 'I', 'ca', ""n't"", 'believe', 'what', 'I', 'had', 'to', 'say', 'All', 'the', 'things', 'you', 'never', 'say', 'I', ""'ll"", 'never', 'be', 'what', 'you', 'want', 'me', 'to', 'be', 'Now', 'I', 'ca', ""n't"", 'disappear', 'Close', 'your', 'eyes', 'and', 'look', 'at', 'me', 'I', 'ca', ""n't"", 'believe', 'what', 'I', 'can', 'not', 'see', 'Everything', 'is', 'like', 'you', 'say', 'Change', 'your', 'mind', 'and', 'you', ""'ll"", 'have', 'to', 'forgive', 'And', 'I', 'ca', ""n't"", 'disappear', 'Now', 'I', 'ca', ""n't"", 'Now', 'I', 'ca', ""n't""]","['just', 'because', 'you', 'call', 'my', 'name', 'I', 'can', 'not', 'hear', 'it', 'be', 'not', 'the', 'same', '(', 'can', 'not', 'close', 'my', '/', 'you', 'close', 'your', ')', 'eye', 'and', 'knock', 'I', 'back', 'all', 'the', 'thing', 'that', 'I', 'have', 'to', '(', 'have', '/', 'live', ')', '(', 'and', 'now', 'you)', '...', 'just', '...', '(fallen', '...', ')', 'I', 'can', 'not', 'believe', 'what', 'I', 'have', 'to', 'say', 'all', 'the', 'thing', 'you', 'never', 'say', 'I', 'will', 'never', 'be', 'what', 'you', 'want', 'I', 'to', 'be', 'now', 'I', 'can', 'not', 'disappear', 'close', 'your', 'eye', 'and', 'look', 'at', 'I', 'I', 'can', 'not', 'believe', 'what', 'I', 'can', 'not', 'see', 'everything', 'be', 'like', 'you', 'say', 'change', 'your', 'mind', 'and', 'you', 'will', 'have', 'to', 'forgive', 'and', 'I', 'can', 'not', 'disappear', 'now', 'I', 'can', 'not', 'now', 'I', 'can', 'not']","[('ADV', 'RB'), ('SCONJ', 'IN'), ('PRON', 'PRP'), ('VERB', 'VBP'), ('PRON', 'PRP$'), ('NOUN', 'NN'), ('PRON', 'PRP'), ('AUX', 'MD'), ('PART', 'RB'), ('VERB', 'VB'), ('PRON', 'PRP'), ('AUX', 'VBZ'), ('PART', 'RB'), ('DET', 'DT'), ('ADJ', 'JJ'), ('PUNCT', '-LRB-'), ('AUX', 'MD'), ('PART', 'RB'), ('VERB', 'VB'), ('PRON', 'PRP$'), ('NOUN', 'NN'), ('PRON', 'PRP'), ('VERB', 'VBP'), ('PRON', 'PRP$'), ('PUNCT', '-RRB-'), ('NOUN', 'NNS'), ('CCONJ', 'CC'), ('VERB', 'VB'), ('PRON', 'PRP'), ('ADP', 'RP'), ('DET', 'PDT'), ('DET', 'DT'), ('NOUN', 'NNS'), ('PRON', 'WDT'), ('PRON', 'PRP'), ('VERB', 'VBD'), ('PART', 'TO'), ('PUNCT', '-LRB-'), ('AUX', 'VB'), ('SYM', 'SYM'), ('VERB', 'VB'), ('PUNCT', '-RRB-'), ('PUNCT', '-LRB-'), ('CCONJ', 'CC'), ('ADV', 'RB'), ('PROPN', 'NNP'), ('PUNCT', ':'), ('ADV', 'RB'), ('PUNCT', ':'), ('PUNCT', '-LRB-'), ('PUNCT', 'NFP'), ('PUNCT', '-RRB-'), ('PRON', 'PRP'), ('AUX', 'MD'), ('PART', 'RB'), ('VERB', 'VB'), ('PRON', 'WP'), ('PRON', 'PRP'), ('VERB', 'VBD'), ('PART', 'TO'), ('VERB', 'VB'), ('DET', 'PDT'), ('DET', 'DT'), ('NOUN', 'NNS'), ('PRON', 'PRP'), ('ADV', 'RB'), ('VERB', 'VBP'), ('PRON', 'PRP'), ('AUX', 'MD'), ('ADV', 'RB'), ('AUX', 'VB'), ('PRON', 'WP'), ('PRON', 'PRP'), ('VERB', 'VBP'), ('PRON', 'PRP'), ('PART', 'TO'), ('AUX', 'VB'), ('ADV', 'RB'), ('PRON', 'PRP'), ('AUX', 'MD'), ('PART', 'RB'), ('VERB', 'VB'), ('ADV', 'RB'), ('PRON', 'PRP$'), ('NOUN', 'NNS'), ('CCONJ', 'CC'), ('VERB', 'VB'), ('ADP', 'IN'), ('PRON', 'PRP'), ('PRON', 'PRP'), ('AUX', 'MD'), ('PART', 'RB'), ('VERB', 'VB'), ('PRON', 'WP'), ('PRON', 'PRP'), ('AUX', 'MD'), ('PART', 'RB'), ('VERB', 'VB'), ('PRON', 'NN'), ('AUX', 'VBZ'), ('SCONJ', 'IN'), ('PRON', 'PRP'), ('VERB', 'VBP'), ('VERB', 'VB'), ('PRON', 'PRP$'), ('NOUN', 'NN'), ('CCONJ', 'CC'), ('PRON', 'PRP'), ('AUX', 'MD'), ('VERB', 'VB'), ('PART', 'TO'), ('VERB', 'VB'), ('CCONJ', 'CC'), ('PRON', 'PRP'), ('AUX', 'MD'), ('PART', 'RB'), ('VERB', 'VB'), ('ADV', 'RB'), ('PRON', 'PRP'), ('AUX', 'MD'), ('PART', 'RB'), ('ADV', 'RB'), ('PRON', 'PRP'), ('AUX', 'MD'), ('PART', 'RB')]",['you)'],['NORP'],[you)]
26,Flowers In December,Among My Swan,1996,ALBUM,Before I let you down again I just want to see you in your eyes I would have taken everything out on you I only thought you could understand They say every man goes blind in his heart And they say everybody steals somebody's heart away And I've got nothing more to say about it Nothing more than you would me Send me your flowers of your december Send me your dreams of your candy wine I got just one thing I can't give you Just one more thing of mine They say every man goes blind in his heart They say everybody steals somebody's heart away And I've been wondering why you let me down And I been taking it all for granted,Before I let you down again I just want to see you in your eyes I would have taken everything out on you I only thought you could understand They say every man goes blind in his heart And they say everybody steals somebody's heart away And I've got nothing more to say about it Nothing more than you would me Send me your flowers of your december Send me your dreams of your candy wine I got just one thing I can't give you Just one more thing of mine They say every man goes blind in his heart They say everybody steals somebody's heart away And I've been wondering why you let me down And I been taking it all for granted,"['Before', 'I', 'let', 'you', 'down', 'again', 'I', 'just', 'want', 'to', 'see', 'you', 'in', 'your', 'eyes', 'I', 'would', 'have', 'taken', 'everything', 'out', 'on', 'you', 'I', 'only', 'thought', 'you', 'could', 'understand', 'They', 'say', 'every', 'man', 'goes', 'blind', 'in', 'his', 'heart', 'And', 'they', 'say', 'everybody', 'steals', 'somebody', ""'s"", 'heart', 'away', 'And', 'I', ""'ve"", 'got', 'nothing', 'more', 'to', 'say', 'about', 'it', 'Nothing', 'more', 'than', 'you', 'would', 'me', 'Send', 'me', 'your', 'flowers', 'of', 'your', 'december', 'Send', 'me', 'your', 'dreams', 'of', 'your', 'candy', 'wine', 'I', 'got', 'just', 'one', 'thing', 'I', 'ca', ""n't"", 'give', 'you', 'Just', 'one', 'more', 'thing', 'of', 'mine', 'They', 'say', 'every', 'man', 'goes', 'blind', 'in', 'his', 'heart', 'They', 'say', 'everybody', 'steals', 'somebody', ""'s"", 'heart', 'away', 'And', 'I', ""'ve"", 'been', 'wondering', 'why', 'you', 'let', 'me', 'down', 'And', 'I', 'been', 'taking', 'it', 'all', 'for', 'granted']","['before', 'I', 'let', 'you', 'down', 'again', 'I', 'just', 'want', 'to', 'see', 'you', 'in', 'your', 'eye', 'I', 'would', 'have', 'take', 'everything', 'out', 'on', 'you', 'I', 'only', 'think', 'you', 'could', 'understand', 'they', 'say', 'every', 'man', 'go', 'blind', 'in', 'his', 'heart', 'and', 'they', 'say', 'everybody', 'steal', 'somebody', ""'s"", 'heart', 'away', 'and', 'I', ""'ve"", 'get', 'nothing', 'more', 'to', 'say', 'about', 'it', 'nothing', 'more', 'than', 'you', 'would', 'I', 'send', 'I', 'your', 'flower', 'of', 'your', 'december', 'send', 'I', 'your', 'dream', 'of', 'your', 'candy', 'wine', 'I', 'get', 'just', 'one', 'thing', 'I', 'can', 'not', 'give', 'you', 'just', 'one', 'more', 'thing', 'of', 'mine', 'they', 'say', 'every', 'man', 'go', 'blind', 'in', 'his', 'heart', 'they', 'say', 'everybody', 'steal', 'somebody', ""'s"", 'heart', 'away', 'and', 'I', ""'ve"", 'be', 'wonder', 'why', 'you', 'let', 'I', 'down', 'and', 'I', 'been', 'take', 'it', 'all', 'for', 'grant']","[('SCONJ', 'IN'), ('PRON', 'PRP'), ('VERB', 'VBP'), ('PRON', 'PRP'), ('ADP', 'RP'), ('ADV', 'RB'), ('PRON', 'PRP'), ('ADV', 'RB'), ('VERB', 'VBP'), ('PART', 'TO'), ('VERB', 'VB'), ('PRON', 'PRP'), ('ADP', 'IN'), ('PRON', 'PRP$'), ('NOUN', 'NNS'), ('PRON', 'PRP'), ('AUX', 'MD'), ('AUX', 'VB'), ('VERB', 'VBN'), ('PRON', 'NN'), ('ADP', 'RP'), ('ADP', 'IN'), ('PRON', 'PRP'), ('PRON', 'PRP'), ('ADV', 'RB'), ('VERB', 'VBD'), ('PRON', 'PRP'), ('AUX', 'MD'), ('VERB', 'VB'), ('PRON', 'PRP'), ('VERB', 'VBP'), ('DET', 'DT'), ('NOUN', 'NN'), ('VERB', 'VBZ'), ('ADJ', 'JJ'), ('ADP', 'IN'), ('PRON', 'PRP$'), ('NOUN', 'NN'), ('CCONJ', 'CC'), ('PRON', 'PRP'), ('VERB', 'VBP'), ('PRON', 'NN'), ('VERB', 'VBZ'), ('PRON', 'NN'), ('PART', 'POS'), ('NOUN', 'NN'), ('ADV', 'RB'), ('CCONJ', 'CC'), ('PRON', 'PRP'), ('AUX', 'VBP'), ('VERB', 'VBN'), ('PRON', 'NN'), ('ADJ', 'JJR'), ('PART', 'TO'), ('VERB', 'VB'), ('ADP', 'IN'), ('PRON', 'PRP'), ('PRON', 'NN'), ('ADJ', 'JJR'), ('SCONJ', 'IN'), ('PRON', 'PRP'), ('AUX', 'MD'), ('PRON', 'PRP'), ('VERB', 'VB'), ('PRON', 'PRP'), ('PRON', 'PRP$'), ('NOUN', 'NNS'), ('ADP', 'IN'), ('PRON', 'PRP$'), ('NOUN', 'NN'), ('VERB', 'VB'), ('PRON', 'PRP'), ('PRON', 'PRP$'), ('NOUN', 'NNS'), ('ADP', 'IN'), ('PRON', 'PRP$'), ('NOUN', 'NN'), ('NOUN', 'NN'), ('PRON', 'PRP'), ('VERB', 'VBD'), ('ADV', 'RB'), ('NUM', 'CD'), ('NOUN', 'NN'), ('PRON', 'PRP'), ('AUX', 'MD'), ('PART', 'RB'), ('VERB', 'VB'), ('PRON', 'PRP'), ('ADV', 'RB'), ('NUM', 'CD'), ('ADJ', 'JJR'), ('NOUN', 'NN'), ('ADP', 'IN'), ('NOUN', 'NN'), ('PRON', 'PRP'), ('VERB', 'VBP'), ('DET', 'DT'), ('NOUN', 'NN'), ('VERB', 'VBZ'), ('ADJ', 'JJ'), ('ADP', 'IN'), ('PRON', 'PRP$'), ('NOUN', 'NN'), ('PRON', 'PRP'), ('VERB', 'VBP'), ('PRON', 'NN'), ('VERB', 'VBZ'), ('PRON', 'NN'), ('PART', 'POS'), ('NOUN', 'NN'), ('ADV', 'RB'), ('CCONJ', 'CC'), ('PRON', 'PRP'), ('AUX', 'VBP'), ('AUX', 'VBN'), ('VERB', 'VBG'), ('SCONJ', 'WRB'), ('PRON', 'PRP'), ('VERB', 'VBP'), ('PRON', 'PRP'), ('ADP', 'RP'), ('CCONJ', 'CC'), ('PRON', 'PRP'), ('AUX', 'VBD'), ('VERB', 'VBG'), ('PRON', 'PRP'), ('PRON', 'DT'), ('ADP', 'IN'), ('VERB', 'VBN')]",[],"['DATE', 'CARDINAL']","[december, one]"
27,Hair and Skin,Flowers in December,1996,SINGLE,"Your hair and your eyes I saw them in the night Your face, your disguise I felt it in the night Your cool clammy skin It could be right beside me I saw you swimmin' over here You looked so fragile And don't you know her eyes were red? Your hair and your skin I know my desire I felt akin To my desire Your eyes and your face I dreamed them in the night Your hair and your skin I saw them swimmin' over here And don't you know you're life itself?","Your hair and your eyes I saw them in the night Your face, your disguise I felt it in the night Your cool clammy skin It could be right beside me I saw you swimmin' over here You looked so fragile And don't you know her eyes were red? Your hair and your skin I know my desire I felt akin To my desire Your eyes and your face I dreamed them in the night Your hair and your skin I saw them swimmin' over here And don't you know you're life itself?","['Your', 'hair', 'and', 'your', 'eyes', 'I', 'saw', 'them', 'in', 'the', 'night', 'Your', 'face', ',', 'your', 'disguise', 'I', 'felt', 'it', 'in', 'the', 'night', 'Your', 'cool', 'clammy', 'skin', 'It', 'could', 'be', 'right', 'beside', 'me', 'I', 'saw', 'you', 'swimmin', ""'"", 'over', 'here', 'You', 'looked', 'so', 'fragile', 'And', 'do', ""n't"", 'you', 'know', 'her', 'eyes', 'were', 'red', '?', 'Your', 'hair', 'and', 'your', 'skin', 'I', 'know', 'my', 'desire', 'I', 'felt', 'akin', 'To', 'my', 'desire', 'Your', 'eyes', 'and', 'your', 'face', 'I', 'dreamed', 'them', 'in', 'the', 'night', 'Your', 'hair', 'and', 'your', 'skin', 'I', 'saw', 'them', 'swimmin', ""'"", 'over', 'here', 'And', 'do', ""n't"", 'you', 'know', 'you', ""'re"", 'life', 'itself', '?']","['your', 'hair', 'and', 'your', 'eye', 'I', 'see', 'they', 'in', 'the', 'night', 'your', 'face', ',', 'your', 'disguise', 'I', 'feel', 'it', 'in', 'the', 'night', 'your', 'cool', 'clammy', 'skin', 'it', 'could', 'be', 'right', 'beside', 'I', 'I', 'see', 'you', 'swimmin', ""'"", 'over', 'here', 'you', 'look', 'so', 'fragile', 'and', 'do', 'not', 'you', 'know', 'her', 'eye', 'be', 'red', '?', 'your', 'hair', 'and', 'your', 'skin', 'I', 'know', 'my', 'desire', 'I', 'feel', 'akin', 'to', 'my', 'desire', 'your', 'eye', 'and', 'your', 'face', 'I', 'dream', 'they', 'in', 'the', 'night', 'your', 'hair', 'and', 'your', 'skin', 'I', 'see', 'they', 'swimmin', ""'"", 'over', 'here', 'and', 'do', 'not', 'you', 'know', 'you', 'be', 'life', 'itself', '?']","[('PRON', 'PRP$'), ('NOUN', 'NN'), ('CCONJ', 'CC'), ('PRON', 'PRP$'), ('NOUN', 'NNS'), ('PRON', 'PRP'), ('VERB', 'VBD'), ('PRON', 'PRP'), ('ADP', 'IN'), ('DET', 'DT'), ('NOUN', 'NN'), ('PRON', 'PRP$'), ('NOUN', 'NN'), ('PUNCT', ','), ('PRON', 'PRP$'), ('NOUN', 'NN'), ('PRON', 'PRP'), ('VERB', 'VBD'), ('PRON', 'PRP'), ('ADP', 'IN'), ('DET', 'DT'), ('NOUN', 'NN'), ('PRON', 'PRP$'), ('ADJ', 'JJ'), ('ADJ', 'JJ'), ('NOUN', 'NN'), ('PRON', 'PRP'), ('AUX', 'MD'), ('AUX', 'VB'), ('ADV', 'RB'), ('ADP', 'IN'), ('PRON', 'PRP'), ('PRON', 'PRP'), ('VERB', 'VBD'), ('PRON', 'PRP'), ('VERB', 'VB'), ('PUNCT', ""''""), ('ADV', 'RB'), ('ADV', 'RB'), ('PRON', 'PRP'), ('VERB', 'VBD'), ('ADV', 'RB'), ('ADJ', 'JJ'), ('CCONJ', 'CC'), ('AUX', 'VBP'), ('PART', 'RB'), ('PRON', 'PRP'), ('VERB', 'VB'), ('PRON', 'PRP$'), ('NOUN', 'NNS'), ('AUX', 'VBD'), ('ADJ', 'JJ'), ('PUNCT', '.'), ('PRON', 'PRP$'), ('NOUN', 'NN'), ('CCONJ', 'CC'), ('PRON', 'PRP$'), ('NOUN', 'NN'), ('PRON', 'PRP'), ('VERB', 'VBP'), ('PRON', 'PRP$'), ('NOUN', 'NN'), ('PRON', 'PRP'), ('VERB', 'VBD'), ('ADJ', 'JJ'), ('ADP', 'IN'), ('PRON', 'PRP$'), ('NOUN', 'NN'), ('PRON', 'PRP$'), ('NOUN', 'NNS'), ('CCONJ', 'CC'), ('PRON', 'PRP$'), ('NOUN', 'NN'), ('PRON', 'PRP'), ('VERB', 'VBD'), ('PRON', 'PRP'), ('ADP', 'IN'), ('DET', 'DT'), ('NOUN', 'NN'), ('PRON', 'PRP$'), ('NOUN', 'NN'), ('CCONJ', 'CC'), ('PRON', 'PRP$'), ('NOUN', 'NN'), ('PRON', 'PRP'), ('VERB', 'VBD'), ('PRON', 'PRP'), ('VERB', 'VB'), ('PUNCT', ""''""), ('ADV', 'RB'), ('ADV', 'RB'), ('CCONJ', 'CC'), ('AUX', 'VBP'), ('PART', 'RB'), ('PRON', 'PRP'), ('VERB', 'VB'), ('PRON', 'PRP'), ('AUX', 'VBP'), ('NOUN', 'NN'), ('PRON', 'PRP'), ('PUNCT', '.')]",[],[],[]
